date,city,state,dead,injured,total,description
5/13/19,New Orleans,Louisiana,0,4,4,Three men and a teenager were wounded in a drive-by shooting in the Central City neighborhood.
5/12/19,Miramar,Florida,4,1,5,"2019 Miramar shootout: Four people are dead and one injured after a pair of men rob a jewelry store in Coral Gables, injuring the clerk, then carjack a UPS truck and lead police on a chase that ended in a shootout in Miramar that killed the UPS driver, a bystander, and the suspects."
5/10/19,Lawton,Oklahoma,4,0,4,Two adults and two children were discovered dead in a home.
5/8/19,Suitland,Maryland,1,3,4,One person was killed and three were wounded after a large fight broke out following a funeral service.
5/8/19,New York City,New York,0,4,4,Four people were injured in a shooting during a candlelight vigil in Crown Heights.
5/8/19,San Antonio,Texas,4,0,4,"A man killed his uncle, grandmother and mother before he set the house on fire and committed suicide in a triple murder–suicide."
5/7/19,Chicago,Illinois,0,5,5,Five people were wounded in a shooting in Chicago's Woodlawn community.
5/7/19,Reno,Nevada,1,3,4,One person died and three were wounded in a shooting.
5/7/19,New York City,New York,0,4,4,A gunman opened fire — injuring four people in the East New York neighborhood.
5/7/19,Boston,Massachusetts,0,6,6,Six people were wounded in Boston's Roxbury neighborhood.
5/7/19,Gravette,Arkansas,4,0,4,"Four people were found deceased at a home in an apparent murder–suicide. The deaths consisted of two young males, and one middle aged female, not including the perpetrator who killed himself afterwards."
5/6/19,Santa Rosa,California,0,4,4,"A teenager opened fire at a soccer park, wounding an 11-year-old boy and three others."
5/5/19,North Bergen,New Jersey,1,4,5,"Just before 4 am, officers discovered one person deceased and four people wounded, after a fight potentially escalated."
5/5/19,Oceano,California,0,6,6,Officers responded to a call and discovered six individuals wounded by gunfire; the victims were transported to local hospitals for treatment.
5/2/19,San Antonio,Texas,2,2,4,"A man and woman were killed and two others injured after the shooter kicked open an apartment door and shot inside, before fleeing."
4/30/19,Charlotte,North Carolina,2,4,6,"University of North Carolina at Charlotte shooting: Six people were shot, two fatally, on the last day of classes at the University of North Carolina at Charlotte. The student gunman was taken into custody after he was tackled by one of the students in the classroom. He had several more loaded magazines in a backpack."
4/28/19,Nashville,Tennessee,0,7,7,Two men got into an altercation at a party and exchanged gunfire; seven people were wounded in the crossfire.
4/28/19,Birmingham,Alabama,0,4,4,"A suspect in a vehicle opened fire on patrons outside of a nightclub, injuring four."
4/28/19,Baltimore,Maryland,1,7,8,One person was killed and seven were wounded when a gunman opened fire on two cookouts at an intersection.
4/28/19,West Chester Township,Ohio,4,0,4,"Four family members, three women and one man, were found shot to death in an apartment. The suspect remains at large."
4/27/19,Jackson,Mississippi,1,3,4,One person was killed and three were injured in a shooting in south Jackson.
4/27/19,Jackson,Michigan,0,4,4,Four people were wounded in an overnight shooting.
4/27/19,Poway,California,1,3,4,Poway synagogue shooting: One person was killed and at least three were wounded by a shooter at the Chabad of Poway synagogue.
4/26/19,Hugo,Oklahoma,0,4,4,"Investigators attempted to make contact with the suspect in relation to another crime, he then began to open fire, injuring three children and himself."
4/21/19,Philadelphia,Pennsylvania,0,4,4,Four people were wounded in the Grays Ferry Section of the city.
4/21/19,Los Angeles,California,0,4,4,Four seniors were wounded by gunfire after a suspect opened fire in the vehicle behind them.
4/20/19,Corpus Christi,Texas,0,4,4,A disturbance in a neighborhood escalated into a shooting; four men were wounded.
4/20/19,Memphis,Tennessee,0,7,7,Seven people were wounded in a shooting that police believe occurred after a large fight.
4/19/19,Wichita,Kansas,0,4,4,"Two suspects fired multiple shots at people attending a party, injuring four."
4/18/19,Louisville,Kentucky,0,4,4,Four people in a vehicle were wounded when they were shot at by at least one person in another car.
4/16/19,Germantown,Maryland,1,3,4,A drive-by shooting killed an 18-year-old male and wounded three other men in a cul-de-sac.
4/14/19,Miami,Florida,2,2,4,Two women were killed and another man and woman were wounded in a drive-by shooting outside of Miami's Liberty City neighborhood.
4/14/19,Valleho,California,1,3,4,One man was killed and three were injured in an early morning shooting.
4/14/19,Stockton,California,0,4,4,"A man opened fire inside of a bar following a disturbance, wounding four patrons."
4/12/19,Pearl Harbor,Hawaii,3,1,4,"22-year-old Gabriel Romero, a US Navy sailor and submarine crewman, randomly opened fire just minutes after starting his shift for routine guard duty at at Joint Base Pearl Harbor–Hickam. He opened fire on a group of civilian workers, killing two and wounded another, before immediately shooting himself. The motive is thought to be a toxic cultural environment in the USN, particularly among submarine crewman."
4/12/19,Montgomery,Alabama,2,2,4,Two people were killed and two wounded in an apartment complex.
4/11/19,Houston,Texas,1,3,4,A man was killed and three other people were injured when a person opened fire at a group in a driveway.
4/9/19,Marrero,Louisiana,2,2,4,"A man and a seven-year-old girl were killed, and another man and a 11-year-old boy were injured after an argument apparently escalated."
4/9/19,Jacksonville,Florida,0,4,4,Three adults and a child were wounded in a shooting.
4/8/19,Chicago,Illinois,0,7,7,Seven people were wounded in a drive-by shooting near Douglass Park.
4/8/19,Dayton,Ohio,10,27,37,"2019 Dayton shooting: A gunman killed nine people and injured 27 outside of a bar after he was denied entry, before being killed by police."
4/8/19,Memphis,Tennessee,1,3,4,One man was killed and three others were injured in an early morning shooting.
4/8/19,Chicago,Illinois,1,7,8,One person was killed and seven others were injured in a shooting in the Lawndale community.
4/8/19,Grenada,Mississippi,0,4,4,Four people were discovered wounded in an overnight shooting.
4/7/19,Chicago,Illinois,1,3,4,"One man was killed and three were wounded, after a suspect opened fire from a vehicle."
4/7/19,Los Angeles,California,0,4,4,"Four people, including a 15-year-old girl were wounded, after two perpetrators opened fire in the Historic South-Central neighborhood."
4/7/19,Rockford,Illinois,0,4,4,Four people were wounded after an argument escalated.
4/7/19,Fresno,California,1,3,4,One person was killed and three were injured after gunfire erupted at an Independence Day celebration.
4/5/19,Indianapolis,Indiana,0,4,4,Three teens and one man were injured after a fight involving between 20 and 30 individuals.
4/5/19,Wilmington,Delaware,0,4,4,Four people were wounded in a shooting at West 27th and Tatnall Streets.
4/5/19,St. Louis,Missouri,1,4,5,Five people were shot inside of a vehicle; the incident resulted in one death and four injuries.
4/4/19,Panama City,Florida,1,3,4,One person was killed and three were found with gunshot injuries in Panama City.
4/4/19,Stockbridge,Georgia,3,2,5,Two officers responding to a suspected hostage situation were wounded and three individuals were later found deceased in a murder–suicide.
4/2/19,Baton Rouge,Louisiana,0,4,4,Four people were wounded in an early morning shooting.
4/2/19,Washington D.C.,Washington D.C.,0,5,5,Four men and an elementary-school-age girl were injured in a shooting at a bus stop.
4/1/19,Torrance,California,3,4,7,"An argument at the Torrance bowling alley escalated into a fight and three people were killed by gunshots, at least four others were wounded. A suspect who was out of prison on parole has been arrested."
4/1/19,Houston,Texas,1,3,4,A man injured his brother and two friends before being killed by a police officer.
4/1/19,Hurt,Virginia,3,2,5,A man killed his wife and son in their home and injured two people who were inside a vehicle before killing himself.
3/31/19,North Charleston,South Carolina,0,7,7,Seven people were wounded in a shooting at an overnight house party.
3/31/19,Atlanta,Georgia,1,4,5,One person was killed and four were wounded during a house party.
3/31/19,Chicago,Illinois,1,4,5,One person was killed and four people were wounded in a shooting in East Garfield Park.
3/28/19,Baltimore,Maryland,0,4,4,Four people were wounded in a shooting near a playground.
3/25/19,North Las Vegas,Nevada,0,5,5,An after-school fight led to a shooting in a neighborhood; five teenagers were wounded.
3/24/19,Phoenix,Arizona,0,7,7,"During a warehouse party, a fight broke out and escalated into a shooting; seven people were wounded."
3/24/19,San Francisco,California,1,5,6,A shooting occurred near the Fillmore Heritage Center around 8:40 pm local time; one person was killed and five others were injured.
3/19/19,Phoenix,Arizona,2,4,6,An argument at a house party ended in a shooting when the perpetrator returned to the party and killed two and wounded four before fleeing.
3/17/19,Rochelle,Georgia,1,3,4,"In the early morning, two groups were involved in a dispute, which ended with one person killed and three people wounded."
3/17/19,Las Vegas,Nevada,0,4,4,Four people were wounded at the El Cortez Hotel and Casino in an early morning shooting. The suspect was later arrested.
3/17/19,Augusta,Georgia,0,4,4,"Four people were wounded after an argument, although the shooter claims that it was in self-defense to being randomly attacked."
3/16/19,Camden,New Jersey,1,3,4,"One man was killed and three others were wounded following a shooting at a ""residential speakeasy""."
3/15/19,Mobile,Alabama,2,3,5,Two men were killed and three others were wounded in an overnight shooting behind a home. The suspect was arrested the next day.
3/14/19,Missoula,Montana,1,3,4,"One person was fatally shot and three others were wounded, including a Montana Highway Patrol trooper following a road rage incident."
3/13/19,Harvey,Illinois,1,3,4,One person was killed and three were wounded after gunfire erupted in a nightclub.
3/11/19,Nacogdoches,Texas,1,3,4,"A man shot at five men working on a barn, killing one and injured three others."
3/11/19,Toledo,Ohio,0,4,4,Officers responding to a Shotspotter alert found four people wounded at a nightclub.
3/10/19,Roxboro,North Carolina,1,3,4,A man was killed and three others wounded.
3/10/19,Marshall,Missouri,1,3,4,Three people were wounded and a fourth later died at the hospital in a shooting.
3/8/19,El Paso,Texas,23,23,46,2019 El Paso shooting: 23 people were killed and 23 were injured at a Walmart near the Cielo Vista Mall in a Hispanophobic massacre. The perpetrator was taken into custody.
3/7/19,Katy,Texas,2,3,5,The perpetrator shot and killed his sister and three others at a housewarming party. He later died at a hospital.
3/5/19,Dallas,Texas,1,3,4,Four men were discovered shot at Cherrywood Park after a drive-by shooting; one of the victims died from their injuries.
3/5/19,Baltimore,Maryland,0,4,4,Four people were injured and discovered after a Shot Spotter gunfire alert notified police to the location.
3/5/19,Baltimore,Maryland,0,5,5,"Emergency responders discovered a female and two young children injured, and two men were later identified as being wounded in the same incident."
3/3/19,Oakland,California,0,4,4,Four people were injured in a shooting at a sports bar following a fight.
3/3/19,Chicago,Illinois,0,6,6,Six people were injured in a shooting at a bar following a fight.
3/2/19,Chicago,Illinois,2,5,7,"Around 2 am local time, two people were killed and five people were wounded in a drive-by shooting after a fight outside of a club."
3/1/19,Texas City,Texas,3,1,4,Three children under the age of six were found deceased along with a wounded woman in an apparent home invasion.
2/28/19,Joliet,Illinois,4,0,4,Two adults and their 6 and 1-year-old children were killed in an apparent murder suicide.
2/28/19,Oakland,California,1,4,5,One person was killed and four others were wounded in a shooting near a gas station.
2/22/19,Birmingham,Alabama,2,2,4,Two people were killed and two were injured in a shooting at a party in a home.
2/21/19,Elizabeth,Kentucky,2,2,4,Two people were killed and two others were found wounded in two separate shootings believed to be perpetrated by the same man.
2/21/19,Baltimore,Maryland,1,4,5,"Officers on patrol responded to gunshots, and upon investigation discovered a deceased male and four wounded victims."
2/21/19,Houston,Texas,2,2,4,A gunman perched on the roof of a home killed two and wounded two after an argument led to the incident.
2/20/19,Covington,Tennessee,0,4,4,Three adults and a teenager were injured inside a home in a presumed targeted shooting.
2/18/19,Solon Township,Michigan,4,0,4,"A 28-year-old woman killed her three children, ages 8, 6 and 2, before killing herself."
2/17/19,New Orleans,Louisiana,1,5,6,"After police attempted to arrest a suspect, a gunfight broke out, and led to one person being killed and five being wounded."
2/17/19,Evansville,Indiana,0,5,5,Five people were wounded after shots were fired outside of a bar. Two suspects were taken into custody by police.
2/17/19,Henderson,Texas,2,2,4,"Two people were wounded and two were killed in a shooting at an apartment complex. The suspect was later arrested in Bienville Parish, Louisiana."
2/16/19,Clinton,Mississippi,4,0,5,"Police responded to a domestic dispute at a residence; upon arrival, the suspect fired shots at officers leading to a 12-hour hostage standoff. Four people were killed, and the suspect was taken into custody and later died."
2/15/19,Aurora,Illinois,6,6,12,"Aurora, Illinois shooting: A man opened fire in his workplace, killing five employees, and injuring five police officers and a civilian before being killed by police."
2/14/19,Jacksonville,Florida,2,2,4,"After a fight broke out near a basketball court at a park, multiple people started shooting at each other. Two people were killed, and two were wounded."
2/11/19,Baton Rouge,Louisiana,0,4,4,Four people were wounded in a shooting.
2/11/19,Detroit,Michigan,1,4,5,One person was killed and five injured at an after hours party.
2/9/19,Chicago,Illinois,0,4,4,Four men were wounded in a drive-by shooting outside of a CTA Green Line station in Washington Park.
2/9/19,Elkmont,Alabama,5,0,5,A 14-year-old boy shot dead five family members – two adults and three children – in an Alabama residence. He confessed the crime to the police.
2/9/19,Greensboro,North Carolina,2,2,4,Two men were killed and a woman and small child injured during a home invasion.
2/8/19,Pomfret,Maryland,3,1,4,"A man shot and killed his in-laws, and wounded an 11-year-old boy sitting in a relative's car before committing suicide."
2/8/19,Suffolk,Virginia,2,3,5,"Two men were killed, and two women and a two-year-old were wounded at multiple crime scenes."
2/7/19,Washington Park,Illinois,0,4,4,"A 16-year-old, 12-year-old and an adult were injured when an argument over fireworks escalated. The perpetrator was shot by a by-stander."
2/7/19,Wellston,Missouri,0,4,4,Four people were injured in a drive-by shooting just before midnight near a local food store.
2/4/19,Hermanville,Mississippi,0,4,4,A man shot four people in a drive-by shooting outside of a convenience store.
2/4/19,Covington,Kentucky,0,5,5,Five people were wounded in a drive-by shooting at an intersection.
2/3/19,Pine Bluff,Arkansas,1,4,5,One person was killed and four other were wounded at a party when shots were fired into a home.
2/1/19,Jonesboro,Arkansas,1,3,4,A 16-year-old boy was killed and three others were wounded during a home invasion.
1/28/19,Houston,Texas,2,4,6,Pecan Park Raid: Four police officers were shot while serving a warrant in southeast Houston. The two homeowners were killed.
1/27/19,Birmingham,Alabama,0,5,5,"Police responded to a call and discovered five people with gunshot wounds, along with two of the victims sustaining life-threatening injuries."
1/26/19,Albany,Georgia,0,4,4,"Two people were found with bullet wounds in front of a residence, and two more arrived at a hospital with gunshot injuries from the same shooting."
1/26/19,Indianapolis,Indiana,0,5,5,"A man was asked to leave a bar; shortly after, he came back and shot five people, critically wounding two."
1/26/19,Ascension Parish and Livingston Parish,Louisiana,5,0,5,"January 2019 Louisiana shootings: A 21-year-old man killed five people, including his parents, in two parishes in Louisiana. The suspect fled to Virginia and was arrested the next day."
1/26/19,Newark,New Jersey,1,3,4,"A gunman opened fire on individuals attending a candlelight vigil, killing one, and wounding three others."
1/24/19,State College,Pennsylvania,4,1,5,"A man killed two people and injured one inside a local bar, then drove away and broke into a home and killed the homeowner before killing himself."
1/24/19,Rockmart,Georgia,4,1,5,A man killed four individuals and injured another in two separate shootings.
1/23/19,Sebring,Florida,5,0,5,2019 Sebring shooting: At least five people were killed in a hostage incident and shooting at a bank. The suspect was taken into custody by police.
1/20/19,Miami,Florida,0,4,4,Three adults and a child were wounded in a shooting while attending a block party.
1/19/19,Gaffney,South Carolina,1,4,5,One person was killed and four others were wounded in a shooting at a nightclub.
1/19/19,Chicago,Illinois,0,4,4,"Early in the morning, three women and a man were involved in a fight and were injured in the ensuing shooting."
1/19/19,Lebanon,Pennsylvania,0,4,4,"In an apparent targeted shooting, four individuals were discovered shot in a building."
1/19/19,Houston,Texas,3,2,5,Three people were killed and two more were injured by a homeowner in a possible attempted home invasion.
1/19/19,Jacksonville,Florida,3,2,5,A man killed two people and injured two more before killing himself.
1/17/19,Owensboro,Kentucky,3,1,4,Three people were killed and another person was wounded in a shooting at a home. Two men were arrested in relation to the shooting.
1/16/19,Jacksonville,Florida,1,5,6,"A man was killed and five other people were injured in a shooting. The Mayor of Jacksonville described the shooting as gang-related, although this characterization has been disputed by the sister of the deceased man."
1/16/19,Palmdale,California,3,1,4,Three people were killed and another one was wounded in a shooting.
1/15/19,Little Rock,Arkansas,1,4,5,"An argument over a gun inside a local ice cream shop led to a shooting. One man was killed and four others, including the suspected shooter, were injured."
1/13/19,Phoenix,Arizona,1,5,6,"An argument at a motel escalated into a shooting. One person was killed, and five others were injured."
1/12/19,Aurora,Illinois,1,4,5,"One person was killed and four were injured in a shooting in Aurora, Illinois."
1/12/19,New Orleans,Louisiana,0,10,10,2019 New Orleans shooting: Ten people were shot in a densely populated area with heavy police presence at a time when tens of thousands of tourists were downtown for the Bayou Classic football game.
1/12/19,Cotton Valley,Louisiana,2,3,5,"One woman was killed and three others wounded, including a perpetrator, after an argument escalated at a nightclub."
1/12/19,Comstock Township,Michigan,1,3,4,One person was killed and three police officers wounded when a home invasion turned into a hostage situation.
1/12/19,New Orleans,Louisiana,2,2,4,Two people were killed and two injured at an intersection hours after the first mass shooting in the city.
1/11/19,Tolleson,Arizona,0,5,5,Five teenagers were wounded at a Halloween party in a vacant home.
1/11/19,San Angelo,Texas,0,4,4,Four people were wounded in a drive-by shooting outside a night club.
1/10/19,St. Louis,Missouri,0,4,4,Four men were wounded after two cars drove by a crowd of people and opened fire.
1/9/19,Hartford,Connecticut,0,4,4,Three men and a 17-year-old boy were wounded in a shooting.
1/9/19,Toledo,Ohio,0,4,4,Four people were found shot in the early morning.
1/9/19,Rocky Mount,North Carolina,0,4,4,Four people were shot at a private party at a Moose Lodge.
1/9/19,Valley,Alabama,0,7,7,Six adult males and a 15-year-old boy were wounded outside a kindergarten after an argument over a Lanett vs. Lafayette football game escalated.
1/7/19,Baltimore,Maryland,0,4,4,"Four women were injured after a suspect opened fire on them, two were discovered by police, the others privately entered the hospital."
1/6/19,Portsmouth,Virginia,1,3,4,One person was killed and three were critically injured in an overnight shooting.
1/6/19,Macon,Georgia,0,4,4,Three men and a woman were injured after a suspect opened fire at a block party.
1/6/19,Chicago,Illinois,0,4,4,An adult male and three teenagers were wounded in a shooting in the Austin community of Chicago.
1/6/19,Allendale,South Carolina,0,5,5,Five men were wounded in a shooting at a car wash.
1/6/19,Chicago,Illinois,0,4,4,Four men were wounded in two separate locations near Northwestern University's Gold Coast campus.
1/6/19,Atlanta,Georgia,0,5,5,Police discovered three individuals wounded after responding to a shooting; an additional two were transported via personal vehicles to the hospital.
1/5/19,Boston,Massachusetts,1,3,4,One person was killed and three were wounded while sitting in a parked car in Boston's Dorchester neighborhood.
1/2/19,San Diego,California,0,4,4,A fight broke out at a house party and shots were fired; four people were wounded.
1/1/19,Tallahassee,Florida,0,5,5,Five people were shot and wounded around 3am local time at the University Village Shopping Center.
1/1/19,Columbia,South Carolina,0,5,5,Five people were shot and wounded outside of a nightclub around 6am local time.
12/31/18,Cleveland,Ohio,3,2,5,A dispute began at a rented Airbnb during a New Year's Eve party. Three men were killed and another man and woman were wounded.
12/29/18,Lima,Ohio,1,3,4,One person was killed and three people were wounded in a shooting at an afterhours club.
12/28/18,St. Charles,Missouri,4,1,5,"A gunman shot and killed his girlfriend, her two children, and her mother. He was arrested after exchanging fire with police and attempting to carjack a vehicle."
12/24/18,Lutcher,Louisiana,2,2,4,Three people were killed and two others were wounded in a shooting outside of a bar.
12/23/18,Springfield,Missouri,0,7,7,Seven people were wounded during a shooting at a holiday party.
12/22/18,Las Vegas,Nevada,0,4,4,Four people were wounded during a shooting at a holiday party.
12/18/18,Baltimore,Maryland,0,5,5,Five people were injured in a shooting outside a deli.
12/15/18,Miami,Florida,0,5,5,Five people were wounded in a shooting.
12/14/18,Colorado,Colorado,1,3,4,One person was killed and three others were injured in a shooting near the Colorado Springs Airport.
12/13/18,Philadelphia,Pennsylvania,0,4,4,Four men were injured in a shooting that occurred inside a barbershop. The suspect evaded police but the weapon was recovered.
12/11/18,Dunn,North Carolina,3,1,4,A man killed three people and injured one in a shooting after a fight at a home. The shooter was arrested after crashing a vehicle he stole from the scene.
12/10/18,Spartanburg,South Carolina,0,6,6,Six people were injured in a shooting at a fast food restaurant. One suspect was arrested and another turned himself in to police. A third person is also suspected of being involved.
12/10/18,Las Vegas,Nevada,0,4,4,Four people were wounded after being shot in central Las Vegas.
12/8/18,Pittsburgh,Pennsylvania,0,4,4,A woman shot and injured four people in a street fight in the East Liberty neighborhood of Pittsburgh. She later turned herself in to police.
12/8/18,Clearlake,California,4,1,5,A father killed three of his children and wounded the fourth before killing himself.
12/7/18,Memphis,Tennessee,0,5,5,Five people were wounded in a shooting near a community center. Police believe the shooting was spurred by an earlier fight over a dice game.
12/6/18,New York City,New York,0,4,4,Four people were injured in a shooting in the Bronx.
12/5/18,Omaha,Nebraska,0,7,7,Seven people were wounded in a shooting.
12/5/18,Paulsboro,New Jersey,0,4,4,Four people were injured by gunfire in a shooting following a fight at a birthday party.
12/3/18,Modesto,California,0,4,4,Four people were injured when shots were fired through the garage door of the garage they were in.
12/1/18,Nashville,Tennessee,3,2,5,"A man wounded his stepmother and killed her two daughters before highjacking a car, killing the driver and wounding the passenger. A suspect was arrested after abandoning the car."
11/26/18,Powell,Tennessee,0,4,4,Four people were wounded in a shooting. Two suspects were taken into custody by police.
11/25/18,Oakland,California,0,4,4,Four people were wounded in a drive-by shooting while attending a vigil for a resident of their area who had died of natural causes.
11/25/18,Demopolis,Alabama,2,2,4,Two people were killed and two others were wounded in a shooting at an intersection.
11/25/18,Houston,Texas,1,6,7,"A thirteen-year-old boy was killed and six other people were injured in a shooting at a block party. At least two shooters were involved, and police believe it may have been gang-related."
11/24/18,Orlando,Florida,2,2,4,Two people were killed and two others were wounded in a shooting outside a pizza shop. A suspect was taken into custody by police.
