date,city,state,dead,injured,total,description
8/31/21,Elm City,North Carolina,2,2,4,A man killed one person and wounded two others before kidnapping a woman and infant. He later killed the woman and left the baby alive in the stolen vehicle and is still on the run.
8/30/21,Normal,Illinois,3,3,6,"A man killed two people and wounded three others in a mobile home park, before being killed by responding police."
8/29/21,Nashville,Tennessee,0,5,5,Five people were wounded in an early morning drive by shooting on Jefferson Street.
8/29/21,Milwaukee,Wisconsin,0,4,4,An adult and three teenagers were wounded.
8/29/21,Las Vegas,Nevada,1,3,4,Three adults were wounded and one was killed near Rainbow Boulevard.
8/28/21,Chicago,Illinois,0,4,4,Four adults were wounded in Douglas Park while attending a large gathering.
8/28/21,Albany,New York,0,5,5,"Responding officers found two wounded men, a wounded teenager and two other adults were later found at hospitals."
8/28/21,San Diego,California,0,4,4,"Two groups got into an argument near Belmont Park and a man opened fire, wounding four people."
8/27/21,Sharon Hill,Pennsylvania,1,4,5,"After a football game at a high school, a civilian was injured in a drive-by shooting. Police fired back, which district attorney Jack Stollsteimer says likely hit four people, including an eight-year-old girl who was killed."
8/27/21,Huntington,West Virginia,2,2,4,"Two adults and two children were shot, with an adult and child later dying from their injuries."
8/27/21,Los Angeles,California,0,4,4,Four men were found injured in the West Hollywood neighborhood.
8/26/21,Minneapolis,Minnesota,0,7,7,Seven people were wounded just after midnight when two people opened fire at one another.
8/23/21,Chicago,Illinois,0,4,4,A teenager and three adults were wounded in a drive by shooting in Uptown.
8/22/21,Chicago,Illinois,1,4,5,"A man was killed and three adults and a teenager were wounded in East Garfield Park, about four hours after a previous mass shooting."
8/22/21,Carbondale,Illinois,1,3,4,A SIU student was killed and three other people wounded at a party hosted at a private residence.
8/22/21,Grand Rapids,Michigan,1,3,4,One person was killed and three wounded in an early morning shooting.
8/22/21,Portland,Oregon,0,5,5,Five men were wounded at a vigil for a man that had been killed in the same location earlier in the day.
8/21/21,Chicago,Illinois,1,5,6,"A man was killed and five others wounded while standing in a Calumet Heights parking lot, after two men opened fire from an alley."
8/21/21,Chicago,Illinois,0,4,4,Four people were wounded in an East Garfield Park drive-by.
8/20/21,Flint,Michigan,1,3,4,One person died and three were injured after a shooting.
8/19/21,Edgewood,Maryland,1,3,4,A man was killed and three others wounded in an evening shooting.
8/19/21,Philadelphia,Pennsylvania,1,4,5,A drive-by shooting outside a barbershop killed one and wounded four.
8/19/21,Chicago,Illinois,0,4,4,Four people were shot in a Bronzeville business.
8/18/21,Durham,North Carolina,1,3,4,A man was killed and three injured in a shooting.
8/18/21,Youngstown,Ohio,2,4,6,"Two people, including a 10-year-old girl, were killed, and four wounded after a shooting."
8/18/21,Los Angeles,California,0,4,4,Four men were wounded after a shooting in Playa del Ray.
8/18/21,Germantown,Maryland,1,3,4,"A teenager was arrested for allegedly shooting four people on a basketball court, killing a man and wounding three teenagers."
8/17/21,New York City,New York,0,5,5,Five men were wounded in a drive-by shooting outside a grocery store in Brooklyn.
8/16/21,Detroit,Michigan,1,3,4,A man was killed and three others injured outside a local bar.
8/16/21,New York City,New York,0,8,8,Five women and three men were wounded outside a housing project in Brooklyn shortly after midnight.
8/15/21,San Antonio,Texas,3,2,5,"Three people were killed and two injured after a fight escalated in the parking lot of a local sports bar on the East Side, by a man who drew a long gun and shot into the air."
8/15/21,Chicago,Illinois,0,4,4,Three men and a woman were wounded standing outside a home shortly after midnight.
8/14/21,Trenton,New Jersey,0,4,4,Responding officers found four wounded in the early morning.
8/14/21,Akron,Ohio,0,5,5,Four adults and a teenager were wounded outside a nightclub shortly after midnight.
8/14/21,Indianapolis,Indiana,1,4,5,A man was killed and three adults and a child wounded in a strip mall parking lot in the early morning.
8/14/21,New York City,New York,0,4,4,Four men were wounded in Brooklyn shortly after midnight.
8/13/21,Las Vegas,Nevada,1,6,7,One person was killed and six teenagers wounded after a fight broke out at a local park shortly after midnight.
8/11/21,Philadelphia,Pennsylvania,0,4,4,Three teenagers and an adult were wounded after three of them exited a local store in Feltonville and were chased down the street.
8/10/21,Washington D.C.,Washington D.C.,1,3,4,"Responding police discovered a deceased man and another wounded, with two more identified at local hospitals."
8/10/21,Baltimore,Maryland,0,4,4,Four men were wounded in Southeast Baltimore in the afternoon.
8/9/21,St. Louis,Missouri,0,4,4,Four people were wounded after two men got into an argument after one was seen arguing and pistol whipping a woman.
8/8/21,New York City,New York,2,3,5,Two men were killed and three wounded at an outdoor event space in Brooklyn shortly after midnight.
8/8/21,Chicago,Illinois,1,4,5,A security guard and four others were wounded after a man got into an argument with two security guards outside a club on the South Side.
8/8/21,New Orleans,Louisiana,0,5,5,Five people were shot in the early morning on Bourbon Street. This was the second weekend in a row with a mass shooting in the city.
8/8/21,Chicago,Illinois,1,6,7,"Two men were arguing outside a lounge on the South Side, before it escalated. One of the two was killed, and the other along with five bystanders was injured."
8/8/21,Houston,Texas,1,5,6,A man was killed and five others wounded after a fight in a night club escalated out of the club and into the parking lot.
8/7/21,Hartford,Connecticut,0,4,4,Four men were wounded by five teenagers who opened fire at the same location they had wounded a woman two days prior. The teenagers were later arrested.
8/6/21,Memphis,Tennessee,1,4,5,Four people were wounded and one killed in an afternoon shooting. The suspect is known to the victims.
8/6/21,Nashville,Tennessee,1,3,4,Three teenagers were wounded and an adult woman was killed after their cars were boxed in by other vehicles and fired upon. A fourth teenager was injured in a car accident as one of the cars attempted to flee the gunfire.
8/6/21,Houston,Texas,0,5,5,"Four people were shot, and a fifth wounded by bullet fragments in the early morning at a bar. The shooting was believed to be in retaliation of three men being denied entry into the bar."
8/5/21,Citrus Heights,California,0,4,4,Four people were wounded in the parking lot of a night club during the early morning. Responding officers had to break up multiple fights upon arriving.
8/5/21,Gwynn Oak,Maryland,4,1,5,A man killed three people and injured a fourth near a townhouse before setting it on fire. Responding officers shot and killed him. The man was reportedly being watched by the FBI before the incident.
8/5/21,Oakland,California,0,4,4,Four people were wounded in the early morning while standing outside for a gathering near Lake Merritt.
8/5/21,Detroit,Michigan,0,4,4,Shortly after midnight four people were wounded in an alley in the city's Westside.
8/4/21,Bryan,Texas,1,5,6,"A shooting at a cabinet manufacturing store left one person dead, four in critical condition, and one in stable condition. One of the injured is a Texas State Trooper. The suspected shooter is now in custody."
8/3/21,Clearwater,Florida,1,3,4,One man died and three people were injured in a shooting. Police believe the shooting was targeted.
8/2/21,Mobile,Alabama,0,4,4,Three adults and a juvenile were shot and injured in an evening shooting.
7/31/21,Chicago,Illinois,0,4,4,Four adults were wounded in an early morning shooting while at a gathering in Jackson Park on the South Side.
7/31/21,Columbus,Ohio,1,4,5,"Five people were wounded in an early morning shooting outside a local bar, and one died later at the hospital. An argument escalated causing a gunfight between multiple people."
7/31/21,Saginaw,Michigan,2,2,4,Two people were wounded and two killed at a large public gathering.
7/31/21,New York City,New York,0,10,10,"Ten people, including seven bystanders, were wounded in a night-time gang shooting outside a laundromat. The incident took place in North Corona, Queens."
7/31/21,Indianapolis,Indiana,0,5,5,Three adults and two children were wounded outside a funeral home. It is believed an argument escalated inside the building prior.
7/31/21,Lexington,Kentucky,0,5,5,Responding officers found five people wounded in an evening shooting.
7/29/21,Pittsburgh,Pennsylvania,3,2,5,"After an argument a man shot and killed his parents. He called 911, and stated he wished to turn himself in, but opened fire at responding officers wounding two. He fled the scene in a vehicle that he crashed and was discovered dead due to a self inflicted gunshot wound."
7/29/21,Davenport,Iowa,0,4,4,A feud between the occupants of two vehicles escalated into gunfire injuring three adults and a child.
7/28/21,Charleston,South Carolina,1,4,5,"Five people were wounded in an afternoon shooting, with one later dying at the hospital."
7/28/21,Washington D.C.,Washington D.C.,0,4,4,Four adults were wounded in a shooting in Southeast DC.
7/26/21,Fort Worth,Texas,2,3,5,"A shooter killed one and injured three after opening fire at a backyard party, after becoming upset, leaving and returning. He was chased down by partygoers who threw bricks at him in defense, and was pronounced dead by responding police."
7/25/21,Seattle,Washington,2,3,5,Two people were killed and three injured after someone opened fire on a group leaving a nightclub.
7/25/21,Chicago,Illinois,0,5,5,"Five men were wounded shortly after midnight while standing in an Austin backyard, after a man entered and opened fire."
7/25/21,Wasco,California,5,1,6,"When responding to a hostage situation at a home in Wasco, officers were fired upon by the shooter. Two officers were shot, and one succumbed to their injuries. Three people inside the house were slain by the shooter. The gunman was also killed during the shootout."
7/25/21,Detroit,Michigan,0,7,7,Seven people were wounded at a candlelit vigil on the West Side for a hit and run victim. The shooter pulled up in a vehicle and opened fire on the crowd.
7/24/21,Amarillo,Texas,0,6,6,Six people were wounded in an early morning shooting after an argument escalated at an after-hours club.
7/24/21,Columbus,Ohio,0,4,4,Four people were wounded in a parking lot in Short North in an early morning.
7/24/21,Macon,Georgia,2,2,4,Two people were killed and two injured shortly after midnight after a fight escalated.
7/23/21,Spartanburg,South Carolina,2,2,4,Two people were killed and two wounded in a drive-by-shooting.
7/23/21,San Rafael,California,2,4,6,"Two people were killed and four injured inside a parking garage near a local nightclub. Responding officers attempted to stop multiple vehicles leaving the structure, with some carrying shooting victims."
7/23/21,Darlington,South Carolina,0,4,4,Four people were wounded in a van after individuals in a pickup truck opened fire in the early morning.
7/22/21,Houston,Texas,1,5,6,One person was killed and five injured outside a local restaurant in a drive-by shooting.
7/21/21,Chicago,Illinois,2,3,5,A 15-year-old and a 16-year-old were killed and three other adults were wounded on a street corner. The 16-year-old died the next day.
7/21/21,Chicago,Illinois,2,3,5,"Ten minutes after an earlier shooting, three teenagers  and two adults were wounded in North Lawndale."
7/21/21,Adelphi,Maryland,1,4,5,A man was killed and four others wounded at a condo complex after an argument escalated.
7/21/21,Chicago,Illinois,0,8,8,"Shortly before midnight someone opened fire on a party bus passing by a gas station in Old Town. Seven people were wounded in the bus, and one while pumping gas."
7/20/21,Jacksonville,Texas,4,0,4,Four adults were killed in a robbery after three men broke into their home. The three men were arrested later the next day.
7/19/21,Perth Amboy,New Jersey,0,6,6,A gunman opened fire at a group of people leaving a bar early in the morning. Six people were wounded.
7/19/21,Chicago,Illinois,0,4,4,Four men were injured in Homan Square while standing outside at night.
7/18/21,Houston,Texas,3,2,5,Responding officers arrived at a motel where a man was threatening to kill others and responding officers. The man shot and killed two adults and wounded two others before being shot and killed by police.
7/18/21,Burlington,North Carolina,0,4,4,Four were wounded in a shooting after an argument.
7/18/21,Toledo,Ohio,1,3,4,One person was killed and three wounded in a shooting.
7/18/21,Gainesville,Florida,1,4,5,A man was killed and four others wounded in a drive by shooting outside of a convenience store.
7/18/21,Walnut Creek,California,1,3,4,One person died and three were wounded after a shooting outside a nightclub.
7/18/21,Tucson,Arizona,2,4,6,"Two EMTs were injured after a man opened fire on them as they responded to an unrelated medical incident. The man then drove to a nearby structure fire and shot at nearby people, killing a bystander and wounding a firefighter."
7/17/21,Portland,Oregon,1,6,7,A woman was killed and six others were injured in a shooting in Downtown Portland.
7/17/21,Chicago,Illinois,0,6,6,Five teenage girls aged 12 to 19 years old were wounded while standing outside a party in Austin on the West Side.
7/16/21,Greenville,South Carolina,1,3,4,One person was killed and three injured at Conestee Park after an argument escalated.
7/16/21,Washington D.C.,Washington D.C.,1,5,6,A six-year-old girl was killed and five adults were injured in a shooting in the nation's capital.
7/16/21,Sacramento,California,2,4,6,Shortly before midnight two men were killed and four others injured in Old Sacramento near the old train tracks.
7/16/21,Manchester,New Hampshire,0,4,4,Four people were wounded as passengers in a van taking them from a nightclub.
7/16/21,Chicago,Illinois,1,3,4,One man was killed and three others injured in Austin shortly before midnight.
7/16/21,Philadelphia,Pennsylvania,1,4,5,An adult was killed and three adults and a fourteen-year-old injured in an evening shooting.
7/15/21,Boston,Massachusetts,0,4,4,Officers responding to a ShotSpotter alert discovered four people wounded at the Bromley Heath Projects in Mission Hill.
7/15/21,Levelland,Texas,1,3,4,Officers responding to a 911 call were fired upon by a suspect who barricaded themselves in a home. One officer was killed and three injured.
7/15/21,Lake Ozark,Missouri,1,4,5,A man was killed and four others injured after an argument and physical fight between multiple motorcycle clubs escalated.
7/14/21,Chicago,Illinois,0,5,5,Five adults were wounded outside a food mart in Gresham after three men jumped out of a car and opened fire.
7/14/21,Claymont,Delaware,2,2,4,A man and teenager were killed and two adults wounded in an evening shooting in the Knollwood neighborhood.
7/14/21,Chicago,Illinois,0,5,5,"Five people were wounded in West Garfield Park on the West Side, after a man approached them and opened fire."
7/13/21,Detroit,Michigan,1,6,7,"A man was killed and six others wounded at a banquet hall, after a shooter opened fire due to an earlier argument. Attendees fired back and wounded the suspect, who was later arrested."
7/13/21,Indianapolis,Indiana,0,4,4,"Four men were wounded in an early morning shooting, three of the four were found in a vehicle."
7/11/21,Kenosha,Wisconsin,1,3,4,A man was killed and three others wounded in the early morning.
7/10/21,Milwaukee,Wisconsin,0,5,5,Five people were wounded when a police officer opened fire on an armed suspect who returned fire before he fled the area.
7/10/21,Chicago,Illinois,0,4,4,Two teenagers and two adults were wounded in the early morning after someone opened fire on another car on the Near North Side.
7/10/21,Milwaukee,Wisconsin,3,1,4,Three adults were killed and another wounded after two men came back thirty minutes after an argument over parking and opened fire.
7/9/21,Wichita,Kansas,1,5,6,"After getting kicked out of a night club shortly after midnight, a man opened fire killed a man and wounded five women."
7/9/21,Wilmington,Delaware,0,4,4,Four people were wounded in a local park in the Southbridge neighborhood after a drive-by shooting.
7/8/21,Norfolk,Virginia,0,4,4,Four people were wounded in an early morning shooting in the Neon District.
7/8/21,Chicago,Illinois,0,4,4,Four men were wounded in a drive-by shooting.
7/8/21,Montgomery,Alabama,0,4,4,Three men and a woman were wounded shortly after midnight.
7/6/21,Homestead,Florida,3,3,6,"A man killed his girlfriend, and another man, and injured three teenagers in a Florida home. The man committed suicide upon police arrival."
7/6/21,Cleveland,Ohio,0,6,6,Six people were wounded in an early morning shooting while standing on a porch.
7/5/21,Kinloch,Missouri,2,3,5,A fight broke out at a large outdoor party resulting in two men being killed and three others wounded.
7/4/21,Rock Hill,South Carolina,7,0,7,"2021 Rock Hill shooting: Six people, including two children, were killed in a mass shooting at a Rock Hill home. The perpetrator, a former professional NFL player was found dead by suicide in a nearby home."
7/4/21,Milwaukee,Wisconsin,2,2,4,"Four people were shot at a Northside gas station, two of them fatally."
7/3/21,Edwards,Mississippi,0,4,4,"Three adults and a two-year-old child were injured at a child's birthday party, in a local apartment building. The shooter was arrested the next day."
7/1/21,Washington D.C.,Washington D.C.,0,5,5,Three men and two boys were wounded in an evening shooting in Columbia Heights.
6/30/21,Dover,Delaware,1,3,4,"A group of people were fired upon, leaving one killed and three injured."
6/30/21,Marrero,Louisiana,0,4,4,"A car pulled up to another car waiting to turn and opened fire. An adult, ten-month-old, four and fifteen-year olds were all injured."
6/30/21,Chicago,Illinois,0,4,4,Four teenagers were wounded while walking in Little Village on the West Side in the evening.
6/30/21,Houston,Texas,3,1,4,Two adults and a six-year-old were killed and a ten-year-old injured in an evening shooting.
6/28/21,Rochester,New York,1,3,4,"A man opened fire into a crowded Walmart parking lot, killing one and injuring three."
6/27/21,Chicago,Illinois,1,5,6,Five adults and a teenager were wounded in a drive-by shooting while standing outside in South Shore. A woman died later at the hospital
6/27/21,St. Charles,Illinois,1,3,4,A man was killed and three others wounded at a night club in the early morning.
6/27/21,Greensboro,North Carolina,0,4,4,"After an argument escalated at a pool party hosted at an apartment complex, four people were wounded."
6/27/21,Chicago,Illinois,1,10,11,A woman died and ten others were injured after three shooters approached them from an alley and opened fire in Marquette Park.
6/27/21,Memphis,Tennessee,3,1,4,A tenant with a mental disorder killed three and wounded a neighbor in his boarding house.
6/26/21,Fort Deposit,Alabama,1,3,4,An argument escalated at a funeral service after an outside group refused to turn down music in their car. A man was killed and three others injured.
6/26/21,Chicago,Illinois,1,3,4,A man was killed and three others wounded after an argument escalated in the morning in West Rogers Park.
6/26/21,Houston,Texas,1,3,4,A man was killed and three wounded at a pay-per-view event at a nightclub after a fight broke out.
6/25/21,Chicago,Illinois,0,4,4,"Shortly before midnight, two men and two women were injured in a drive-by shooting in Park Manor, in which the shooter drove a moped."
6/25/21,New York City,New York,0,5,5,Five people were shot in an early morning drive-by at a graduation party in the Bronx.
6/25/21,Columbus,Ohio,0,4,4,Two children and two adults were shot in an SUV.
6/24/21,Gainesville,Florida,1,4,5,"Two shooters opened fire at a local American Legion Post, which was hosting a teen party. All five injured were teenagers."
6/23/21,Montgomery,Alabama,2,2,4,Two men were found dead and two more injured by responding police officers.
6/23/21,Chicago,Illinois,0,4,4,Four motorcycle club members were wounded in Englewood.
6/23/21,Buffalo,New York,0,4,4,"Two adults and two children were wounded at the local JFK Park, after a man opened fire."
6/23/21,Chicago,Illinois,0,4,4,Four people were shot while standing outside when two shooters opened fire in South Austin.
6/21/21,Washington D.C.,Washington D.C.,0,4,4,Minnesota Vikings defensive tackle Jaylen Twyman was shot along with three others while visiting his aunt.
6/21/21,St. Louis,Missouri,3,4,7,Three people were killed and four injured in a shooting outside a convenience store.
6/20/21,Richmond,California,3,5,8,"Celebrators of a Marimba; a Guatemalan music and dance party, were shot by multiple shooters who fled in vehicles"
6/20/21,Granger,Indiana,1,4,5,A man was killed and four others were wounded in an early morning shooting at a local brewing companies parking lot.
6/20/21,Atlantic City,New Jersey,1,3,4,One man was killed and three others injured while standing on a porch after a bicyclist opened fire.
6/20/21,Wildwood,Florida,1,10,11,A woman was killed and ten others injured at an annual community Fathers Day celebration. The shooter was shortly arrested.
6/20/21,Cincinnati,Ohio,1,3,4,A woman was killed and three others injured shortly after midnight.
6/20/21,Aurora,Colorado,1,4,5,A man was killed and four others wounded during an early morning Juneteenth celebration at a local strip mall.
6/20/21,Richmond,Virginia,1,3,4,A man was killed and three wounded while leaving Shockoe Bottom after someone opened fire on a group of people.
6/20/21,Dallas,Texas,0,8,8,"Eight people were wounded in a shootout between two groups after an argument escalated. Each group had rented a party space, and two of the injured were children."
6/19/21,Baton Rouge,Louisiana,2,4,6,Two people were killed and four injured in a parking lot after an argument escalated between unknown people and partygoers leaving a concert.
6/19/21,Oakland,California,1,6,7,A man was killed and five others injured at Lake Merritt near the city's Juneteenth celebration.
6/19/21,Anchorage,Alaska,1,4,5,Four people wounded and one killed in a shooting.
6/19/21,Newark,New Jersey,0,4,4,Responding officers found two wounded men in an early morning shooting. Shortly after two more were identified at a local hospital.
6/18/21,Minneapolis,Minnesota,0,5,5,Shortly before midnight five people were wounded in Dinkytown.
6/17/21,Paterson,New Jersey,0,4,4,Four people were wounded in a shooting.
6/17/21,Durham,North Carolina,2,2,4,A shooting killed two and wounded another two.
6/17/21,Glendale,Peoria,1,12,13,"One person was killed and twelve others injured in eight drive-by shootings in the West Valley area. A male suspect was taken into custody. Of the injuries, three were wounded by gunfire, while nine others sustained indirect injuries, such as shrapnel from broken glass due to a car crash."
6/17/21,Petersburg,Virginia,0,4,4,Four men were wounded in a shooting.
6/16/21,Baltimore,Maryland,1,5,6,"Six people were shot, one fatally, in West Baltimore."
6/15/21,Chicago,Illinois,0,5,5,Five people were wounded at West Garfield Park.
6/15/21,Chicago,Illinois,5,3,8,Four women were killed and three others injured after gunfire erupted in a South Side residence. Another woman died in a hospital.
6/15/21,Albertville,Alabama,2,2,4,A shooting at a Mueller Water Products factory killed two and injured two others.
6/14/21,Boynton Beach,Florida,1,3,4,A drive-by shooting on Interstate 95 killed one and injured three.
6/14/21,Lansing,Michigan,2,2,4,Two people were killed and two others injured at a city park.
6/13/21,Louisville,Kentucky,1,3,4,One man was killed and three other people were injured after a shooting in a Newburg neighborhood.
6/13/21,West Salem,Ohio,1,5,6,An altercation resulted in a shooting that killed one and injured five others at a racetrack.
6/12/21,Philadelphia,Pennsylvania,0,4,4,Three men and a teenager were wounded in Brewerytown.
6/11/21,Marshall,Texas,0,6,6,Six people were wounded in the early morning at a large community event.
6/11/21,Highland,California,0,4,4,"Shortly after midnight a man opened fire at a local bar, wounding four."
6/11/21,Oakley,California,2,2,4,Two people were killed and two wounded at a family birthday party.
6/10/21,Baltimore,Maryland,1,5,6,A woman was killed and five people were wounded in East Baltimore.
6/10/21,Cleveland,Ohio,0,4,4,Four adults were wounded at a music studio shortly before midnight.
6/10/21,New Orleans,Louisiana,1,3,4,A man was killed and three others wounded after four people exited a vehicle and opened fire on them. The victims were doing work in a parking lot behind a church.
6/9/21,Atlanta,Georgia,0,5,5,"A man opened fire after an argument at a local Black Pride festival, wounding five."
6/8/21,Nashville,Tennessee,0,4,4,"Four people, two on the side walk and two in a vehicle, were wounded in a drive-by shooting in West Nashville."
6/6/21,Portland,Oregon,4,0,4,Four people were shot dead at a home in southeast Portland.
6/6/21,Maury,North Carolina,0,4,4,Four people were injured by gunfire at a party in a trailer park.
6/6/21,Kendall,Florida,3,6,9,Three people were killed and six more injured at a graduation party inside of a restaurant/hookah lounge.
