date,city,state,dead,injured,total,description
8/9/20,Baltimore,Maryland,0,5,5,Five people including a seventeen-year-old were injured while playing a dice game when a vehicle pulled up and opened fire.
8/8/20,Philadelphia,Pennsylvania,0,6,6,"A pregnant woman, three teenagers and two other women were wounded. They were a part of a large BBQ gathering at a public park."
8/8/20,Albany,New York,1,3,4,"A 18-year-old man was killed and a 22-year-old, 28-year-old, and 29-year-old were injured in a drive by shooting involving multiple suspected perpetrators."
8/8/20,Paducah,Kentucky,1,4,5,Shortly before midnight a man was killed and four others wounded in the city's north side.
8/8/20,Brockton,Massachusetts,0,5,5,Five men were wounded at a house party which was detected by the city's gunshot detection system. Prior a woman from the same party was stabbed.
8/8/20,Birmingham,Alabama,1,5,6,"A man was killed and five people, including an off-duty Birmingham Police officer, were wounded at a motorcycle club in Ensley. The shooting was reported to be due to an altercation escalating, with some of the victims innocent bystanders."
8/6/20,Memphis,Tennessee,0,4,4,A home was shot at first then after police investigated the shooters return and opened fire. Four people were injured in the second shooting including an 18-month-old infant.
8/6/20,New York City,New York,0,4,4,"A woman, two men and a 17-year-old were wounded after an argument escalated in Brooklyn. The shooter fled the scene."
8/4/20,Greenwood,South Carolina,1,3,4,A 19-year-old was killed and three others individuals were wounded at an apartment complex.
8/4/20,Detroit,Michigan,0,4,4,One man and three women were injured after an altercation escalated. A male shooter escaped the scene and a female was arrested for pointing a weapon at one of the wounded.
8/4/20,Anchorage,Alaska,0,4,4,Police responding to a call of shots fired found one person wounded and an additional three connected to the shooting were found in local hospitals.
8/3/20,South Holland,Illinois,0,4,4,"Four men were wounded in a vehicle on Bishop Ford Freeway, after another vehicle's occupant fired on them."
8/3/20,Milwaukee,Wisconsin,1,3,4,An early morning argument escalated and resulted in one man killed and three injured outside a local business.
8/3/20,Ceres,California,1,3,4,"Police responded to reports of a shooting and discovered three wounded individuals, one of whom later died. A fourth victim arrived at a hospital in a private vehicle."
8/3/20,Rosedale,Maryland,1,5,6,"A 13-year-old boy was killed, five others were wounded; a 14-year-old boy and girl, two 12-year-old boys and a 19-year-old man were wounded. The group was shot at in a parking lot after an altercation while attending a Triple Threat Elite Dance event."
8/2/20,Houston,Texas,1,3,4,A 29-year-old rap artist was killed and three others were wounded in a shooting in North Houston. The wounded victims' conditions are unknown. The suspects are gang members according to the chief of police.
8/1/20,Bay Saint Louis,Mississippi,2,2,4,Two people were killed and two injured in a random ambush style shooting. The perpetrator was arrested after arriving at his mother's house covered in blood.
7/31/20,Philadelphia,Pennsylvania,1,3,4,A woman was killed and three men were wounded in an evening shooting.
7/30/20,Tampa,Florida,0,5,5,A man opened fire at a gas station while screaming at passersby. He wounded five people before he was arrested.
7/30/20,Miami Gardens,Florida,0,5,5,Five men were wounded after a potentially gang related shooting occurred behind a U-Gas Station. A witness likened the amount of gunfire to the Iraq war.
7/29/20,Detroit,Michigan,0,4,4,Three men and a woman were injured while standing outside and a person opened fire from a car.
7/29/20,Elyria,Ohio,5,0,5,"A man killed his wife and three children, aged 12, 10 and 6-years-old, and then himself in an apparent murder-suicide."
7/29/20,St. Louis,Missouri,3,1,4,Three men were killed and a third injured after an afternoon dispute escalated between two groups of people.
7/28/20,Milwaukee,Wisconsin,0,4,4,Four men were injured in the evening.
7/28/20,Wilmington,Delaware,2,2,4,A 17-year-old and a woman were killed and two men were injured in a shooting.
7/27/20,Federal Way,Washington,1,3,4,A 17-year-old was killed and two adults and a 12-year-old injured at Steel Lake Park. A woman reportedly opened fire after an argument.
7/27/20,Chicago,Illinois,1,4,5,Five people were sitting on a porch in the evening when one was killed and four injured in a drive-by shooting.
7/26/20,Flint Township,Michigan,1,3,4,"One person was killed and three others were injured when two men opened fire in a restaurant. One man was charged with open murder, three counts of assault with intent to murder and multiple weapons charges. The other man was charged with careless discharge of a firearm."
7/26/20,Commerce City,Colorado,1,3,4,Responding officers to a large gathering in the early morning found a man dead. Three additional victims were transported in private vehicles to the hospital.
7/26/20,Louisville,Kentucky,1,3,4,"Officers responded to I-64 West in the early morning after calls of shots fired by a moving vehicle. They found four individuals shot, with one dead, in a crashed car. A fifth individual was wounded when the car crashed."
7/26/20,Mont Enterprise,Texas,0,4,4,Four people were injured shortly after midnight when someone opened fire during the Rude Boyz Annual Trail Ride. The gathering was held at Durango's Canyon.
7/26/20,Magnolia,Arkansas,0,4,4,Four people were injured in the early morning after at least two semi-automatic handguns were fired at a large house party.
7/25/20,Denver,Colorado,2,3,5,Two men were killed and two woman and a man were wounded in the Park Hill neighborhood.
7/25/20,Manteca,California,0,7,7,Officers responded from a traffic stop after hearing gunfire. They discovered seven people wounded at a large house party after a man armed with a semi-automatic weapon arrived and opened fire.
7/25/20,Miami,Florida,1,3,4,"A seven-year-old girl, a sixteen-month boy and two adults were shot by a passing vehicle while getting out of a car. The girl was declared brain dead at the hospital, causing the shooting to be declared a homicide."
7/25/20,Dallas,Texas,0,4,4,"Three men and a woman were injured shortly before midnight. A man was denied entry at a local bar, retrieved an assault-type weapon from his car, and shot into the building."
7/25/20,Raleigh,North Carolina,0,4,4,A woman and three men were wounded near a local restaurant.
7/25/20,Flint,Michigan,0,6,6,"Six people were shot at a party of over 1,000 people following the filming of a music video in a parking lot."
7/24/20,Atlanta,Georgia,2,2,4,"Two adults were killed and two teenagers, aged seventeen and eighteen, were injured in an early morning shooting. The group were ambushed by two shooters after arriving at an AirBnb house party in a rideshare."
7/23/20,Chicago,Illinois,2,4,6,Two people were killed and four injured while standing on the sidewalk in the West Pullman area of the Far South Side.
7/23/20,Henrico County,Virginia,1,3,4,One man was killed and three others injured in the early morning. Officers are investigating if the individuals were a part of an announced party for that night.
7/23/20,Petersburg,Virginia,0,4,4,Four people were wounded in an early morning shooting.
7/22/20,Warren,Michigan,0,4,4,A man opened fire and others returned fire at a large party with at least one hundred people in attendance. Four people were injured in the shooting.
7/21/20,Chicago,Illinois,0,15,15,"Fifteen people were injured, four critically, after a shooter opened fire at people leaving a funeral home in Chicago's Auburn Gresham neighborhood."
7/20/20,Chicago,Illinois,0,5,5,Five people were wounded in the North Lawndale neighborhood. They were a part of people gathered on the sidewalk when a car pulled up and several men got out and opened fire.
7/20/20,Richmond,Virginia,1,4,5,One man was killed and four others injured after a fight in a McDonald's parking lot escalated. One of the injured was an innocent bystander in the Food Lion parking lot across the street.
7/19/20,Peoria,Illinois,0,13,13,Thirteen people were injured in an early morning shooting at a riverfront gathering. An argument between two women led to a man firing two shots into the air. This led to multiple individuals opening fire on the crowd.
7/19/20,Detroit,Michigan,0,4,4,"Two fifteen-year-olds and two seventeen-year-olds were wounded while sitting in traffic when another car pulled up and opened fire. Four days later, the suspect was shot by police after a pursuit in which he was found holding a gun and died at a hospital."
7/19/20,Detroit,Michigan,3,1,4,"A man opened fire in a restaurant, killing three men and injuring another. The shooter has been taken into custody."
7/19/20,Chicago,Illinois,2,3,5,"Two people were killed and three wounded shortly before midnight in Morgan Park on the Far South Side. They were part of a group of people, that were fired upon by an unknown shooter."
7/19/20,Washington D.C.,Washington D.C.,1,8,9,Police responding to reports of a shooting discovered one man killed and eight other adults wounded.
7/19/20,Omaha,Nebraska,0,8,8,Eight people including a fifteen-year-old girl were injured in a drive by shooting early in the morning.
7/18/20,Chicago,Illinois,1,4,5,A man was killed and four others wounded after two men opened fire in the early morning in the North Lawndale neighborhood. The men were standing on a street corner.
7/17/20,Madison,Florida,0,4,4,"Three adults and a child were injured after a man, out on bond from a January arrest, entered their home and opened fire."
7/17/20,Columbus,Ohio,0,4,4,Four adults were wounded while attending a memorial in Weinland Park. A three-year-old girl was also wounded when bullets struck the home she was in.
7/16/20,Nashville,Tennessee,0,5,5,"Eight or nine people opened fire in the early morning in a drive-by shooting. Five people were wounded, including a juvenile."
7/15/20,New York City,New York,1,5,6,Two gunmen opened fire in the early morning outside a Brooklyn apartment building. A man was killed and five other adults were wounded.
7/15/20,Shreveport,Louisiana,1,3,4,A man was killed and two adults and an 11-year-old child were injured after an argument escalated from an original argument at a basketball court.
7/14/20,St. Joseph,Missouri,0,5,5,Five men were injured while standing in a park after a vehicle drove by and opened fire.
7/14/20,Durham,North Carolina,0,8,8,Six adults and two children aged four and eight-years-old were wounded after someone opened fire at a party outside a home.
7/13/20,New York City,New York,0,6,6,Multiple shooters traveled across three different blocks and wounded six people in Brooklyn.
7/13/20,Louisville,Kentucky,1,3,4,"A 16-year-old was killed and three others, including two juveniles, were wounded at a gas station."
7/13/20,Kent,Washington,0,6,6,Five adults and a teenager were wounded after an argument escalated at a Metro bus stop.
7/11/20,Rock Hill,South Carolina,1,3,4,One individual was killed and three injured inside a local bar shortly after midnight.
7/11/20,Ogden,Kansas,0,4,4,Four men were wounded outside a local bar shortly before midnight.
7/10/20,New York City,New York,1,3,4,One man was killed and three injured in an evening shooting at a Brooklyn building. Neighbors claim that the building was a local gambling den.
7/10/20,Anchorage,Alaska,1,4,5,A man was killed and one man and three women were injured in an early morning shooting at a house party. Two teenagers were arrested and charged for the shooting.
7/9/20,Aguanga,California,7,0,7,A shooting at a large marijuana grow house left seven people dead.
7/9/20,Chicago,Illinois,1,3,4,An eight-year-old girl was killed and three others injured when another vehicle opened fire on them while they were sitting in another car in the Canaryville neighborhood.
7/9/20,New York City,New York,0,5,5,"A fifteen-year-old shooter opened fire at a group of people in a drive-by shooting, including a six-year-old in Brooklyn. Police believe the shooting to be gang related."
7/9/20,New Orleans,Louisiana,0,4,4,Four people including a fourteen-year-old boy were injured in Central City.
7/9/20,Indianapolis,Indiana,1,4,5,An eighteen-year-old was killed and four others injured after a fight broke out during a party in the Butler-Tarkington neighborhood over a broken table.
7/7/20,Alexandria,Virginia,0,5,5,Shortly after midnight an individual stormed an apartment and wounded a man and four teenagers aged 14 to 19-years-old.
7/7/20,Paterson,New Jersey,4,3,7,"In a late night shooting, four people were killed and three injured. Officers suspect the shooting was retaliation by people recently released from prison."
7/6/20,Hope,Arkansas,0,6,6,Six people between 15 and 21-years-old were wounded in the early morning during an social gathering. A seventh individual broke her leg running from the gunfire.
7/6/20,Dyersburg,Tennessee,0,5,5,Five people were wounded inside the local American Legion club in the early morning. All individuals are refusing to speak with police.
7/6/20,Chicago,Illinois,1,3,4,Officers responding to a shots fired call discovered four wounded victims. One victim later died at the hospital and the other three are uncooperative with investigators.
7/6/20,Sikeston,Missouri,2,7,9,Two women were killed and seven other individuals wounded at a house party after a drive-by shooting early in the morning.
7/6/20,Chicago,Illinois,0,6,6,Six men were wounded in a late night drive by shooting while standing on the sidewalk.
7/5/20,Baltimore,Maryland,0,4,4,Four men were discovered shot on the city's west side in the evening.
7/4/20,Chicago,Illinois,1,3,4,"One man was killed and three other individuals wounded, including a 5-year-old, after an individual exited an alley way and opened fire on the group. One of the group likely returned fire at the shooter."
7/3/20,Chicago,Illinois,0,7,7,Six men and a woman were injured in a drive-by shooting after leaving a house party after a fight broke out in the Greater Grand Crossing neighborhood.
7/3/20,Cleveland,Ohio,1,17,18,Seventeen people were wounded and one killed after a shootout between multiple motorcycle clubs after a fight at one of the club's headquarters caused many to be thrown out.
7/3/20,Albuquerque,New Mexico,0,4,4,Three adults and one child were injured by a shooter while exiting a house party. The shooter was later arrested.
7/2/20,Waco,Texas,1,3,4,One man was killed and three others were wounded in a shooting outside and inside a home in Waco. Two of the victims were transported to a hospital by ambulance and were listed in critical condition. The third victim self applied to the hospital but his condition was unknown. Police believe that the motive behind the shooting is the sale of illicit drugs gone wrong.
6/30/20,Greenbrier,Arkansas,0,4,4,"Three adults and one juvenile were wounded, after going to a residence and getting into an altercation. The shooter was a juvenile resident of the home."
6/30/20,Boston,Massachusetts,1,3,4,Officers responding to a call of shots fired discovered four wounded individuals. A man later died at the hospital.
6/30/20,Davenport,Iowa,0,5,5,Five men were wounded in an evening shooting. Officers believed the shooting was targeted at the group.
6/30/20,Atlanta,Georgia,1,4,5,"Early in the morning, a group of men sitting on the sidewalk were shot at in a drive-by. One man was killed and four injured."
6/30/20,Chicago,Illinois,0,4,4,Shortly after midnight three men and a woman were shot while waiting in a vehicle at a Shell gas station in River North neighborhood. The shooter was in and later fled in a red sedan.
6/30/20,Dayton,Ohio,0,4,4,Three men and one women were all wounded in a shooting.
6/29/20,Sioux Falls,South Dakota,1,3,4,"A man shot and killed another man in a home, after mistaking it as the home of his intended target. He left and entered the correct home and wounded three others."
6/29/20,Los Angeles,California,0,4,4,Four men were wounded in a public park in Sylmar in a drive-by shooting.
6/28/20,Sawyerville,Alabama,0,7,7,"During an early morning field party, seven people were wounded after an argument between two men escalated."
6/28/20,Philadelphia,Pennsylvania,2,2,4,Two men were killed and two injured in a late night shooting in the Kensington neighborhood.
6/27/20,Blytheville,Arkansas,3,1,4,"A Missouri man traveled to the area for a house party, where a couple got into a physical domestic fight. Shortly after 911 was called in response to that fight the man opened fire and killed his Uncle and two others, and wounded another."
6/27/20,Roselle,Illinois,1,4,5,"During a party at a rented house, 4 people were wounded and one person was killed when one person began firing a handgun inside the home, and then several people began firing handguns inside the home. Police revealed that over 60 gunshots were fired at the scene."
6/27/20,Red Bluff,California,2,4,6,Red Bluff shooting. An employee was killed and four injured at a Walmart distribution center. The perpetrator was later killed in a shootout with responding police.
6/27/20,Chicago,Illinois,1,3,4,A man was killed and three others wounded after a large gathering in Douglas.
6/27/20,New York City,New York,0,4,4,"Early in the morning a man opened fire at a house party in Brooklyn, and injured four people."
6/27/20,Peoria,Illinois,0,4,4,Officers responding to an early morning ShotSpotter alert found two men wounded and identified two women who arrived at the hospital to be a part of the incident.
6/26/20,Aurora,Colorado,0,5,5,Five people were wounded by a shooter outside a local grocery store. Officers previously thought the incident was a gunfight but later announced it was one shooter.
6/26/20,Fresno,California,0,4,4,"Four people were wounded at a house party shortly before midnight, after two shooters appeared near a neighboring home."
6/26/20,Phoenix,Arizona,0,4,4,"Three adults and a 14-year-old boy were wounded in the early morning at a gas station. Prior to the shooting, a large crowd of people and cars had been gathered around the gas station."
6/25/20,Philadelphia,Pennsylvania,0,4,4,Four men were wounded after a shooting at an intersection in the Kensington neighborhood.
6/25/20,Bridgeport,Connecticut,1,3,4,"A man was killed, and two adults and a 17-year-old injured while attempting to make a rap music video. Officers believed the shooting was targeted, as the victims refused to cooperate."
6/24/20,Jackson,Tennessee,0,4,4,Three adults and one juvenile were wounded in an early morning shooting. The suspected shooter was arrested.
6/23/20,Lake Worth Beach,Florida,0,5,5,Five people were wounded in a drive-by shooting during the evening. Responding police believed the shooter and victims know each other.
6/23/20,Chicago,Illinois,0,4,4,"Four people were wounded in a drive by shooting in Burnside, while standing on a porch."
6/22/20,Chicago,Illinois,0,4,4,Four people were wounded early in the morning after an individual opened fire from a vehicle in the Back of the Yards neighborhood on the South Side.
6/22/20,San Francisco,California,0,5,5,Police discovered five men wounded by gunfire in the Tenderloin neighborhood.
6/22/20,Minneapolis,Minnesota,0,4,4,Four people were wounded in the Willard-Hay neighborhood during the afternoon.
6/22/20,Charlotte,North Carolina,3,6,9,"Officers responding to a block party on reports of someone being hit by a car arrived to shots being fired. Three people were killed and six injured by gunfire, with an additional five injured after being hit by cars while attempting to flee."
6/22/20,Minneapolis,Minnesota,0,4,4,Officers responding to a shooting on West Broadway Avenue discovered four people injured.
6/22/20,Chicago,Illinois,0,5,5,"Five people were wounded in a drive-by, including a 16-year-old girl, at an early morning gathering in East Garfield Park."
6/22/20,New York City,New York,0,5,5,Five people were shot during a vigil in the Crown Heights area of Brooklyn in the evening.
6/21/20,Auburn,Alabama,0,4,4,"Shortly after midnight, officers responded to a home after a complaint of gunshots. They discovered four men wounded."
6/21/20,Minneapolis,Minnesota,1,11,12,"A group of people fired into a crowd, killing one and injuring 11 others."
6/21/20,Austin,Texas,0,5,5,Five people were wounded in an early morning shooting.
6/21/20,Milwaukee,Wisconsin,1,4,5,Early in the morning a shooting occurred at a house party. Five individuals were shot and one died on the way to the hospital in a private vehicle.
6/21/20,Chicago,Illinois,1,3,4,An argument in Humboldt Park escalated shortly after midnight. A man was killed and three wounded.
6/21/20,Buffalo,New York,0,4,4,Four men were wounded after a shooting at an early morning gathering of cars.
6/20/20,Detroit,Michigan,0,4,4,Four people were wounded in a drive-by shooting in the evening.
6/20/20,New York City,New York,0,4,4,Four people were wounded at an overnight park party in the Bronx after an argument escalated.
6/20/20,Janesville,Wisconsin,0,4,4,Officers responding to a shots fired call in the early morning found four people wounded at an adult entertainment venue.
6/20/20,Jersey City,New Jersey,1,4,5,One person was killed and four injured shortly after midnight.
6/20/20,Syracuse,New York,0,9,9,Officers arrived at a large party in a public parking lot after reports of a stolen car was made. An individual opened fire as they arrived and injured nine people including a 17-year-old.
6/20/20,New York City,New York,0,4,4,Three women and a man were injured after a fight broke out between two groups gathered at Claremont park.
6/20/20,Saginaw,Michigan,1,3,4,A woman sitting in her car was killed and three others injured in a separate car early in the morning. A shoot-out had occurred in a large gathering nearby.
6/20/20,Pinetops,North Carolina,2,2,4,Early in the morning two people were killed and two wounded in a shooting.
6/20/20,Wichita,Kansas,0,5,5,Five people were shot at a motel after a party in one of the rooms had an argument that escalated. Police believe the shooting was intended to be targeted.
6/18/20,Albany,New York,0,7,7,"Early in the morning a man was discovered by officers with a gunshot wound. Shortly after transporting the man to the hospital, six other victims were identified at local hospitals to be a part of the same shooting."
6/17/20,Chicago,Illinois,0,4,4,"Three adults and a nine-year-old child were wounded while standing in an apartment complex parking lot in the Gresham neighborhood. A man walked up and opened fire on the group, resulting in a shoot out."
6/16/20,Fort Dodge,Iowa,2,2,4,"In an apparent shoot out at a birthday party, one man was killed and two women injured. A second man died in his vehicle while attempting to drive away from the scene with a gunshot wound."
6/15/20,Chicago,Illinois,0,4,4,A 15-year-old and three adults were gathered outside an apartment when they were injured in a drive-by shooting in the Montclare neighborhood.
6/15/20,Decatur,Illinois,0,4,4,An early morning shooting during a block party injured four people. The suspected shooter was arrested after a local traffic stop.
6/14/20,Minneapolis,Minnesota,1,6,7,Early in the morning six people were wounded and one was killed in an incident. Officers were alerted via a ShotSpotter activation.
6/14/20,Louisville,Kentucky,1,4,5,About 100 people were gathered at a skate park in the early morning when someone opened fire. One person was killed and four injured.
6/14/20,Lake Charles,Louisiana,0,4,4,Four people were wounded in an early morning shooting at a local night club. A suspected shooter was arrested.
6/14/20,Lafayette,Louisiana,0,5,5,Officers responded to an early morning shooting and found five people wounded. All but one were transported to local hospitals.
6/14/20,New Orleans,Louisiana,1,3,4,One man was killed and three others injured during the evening.
6/13/20,Wyandanch,New York,1,7,8,One person was killed and seven others wounded after a shooting at a house party. Local police believe the incident is gang related.
6/13/20,Baltimore,Maryland,0,5,5,Five people were wounded in the Fells Point neighborhood during a large gathering at Broadway Square with many of the crowd drinking alcoholic drinks.
6/13/20,St. Louis,Missouri,1,5,6,Five individuals were wounded and one killed during an early morning shooting in the JeffVanderLou neighborhood.
6/13/20,Hesperia,California,0,5,5,"Over 100 people attended a house party when someone opened fire, injuring five people."
6/13/20,Rison,Arkansas,0,4,4,"Shortly before midnight, four individuals were wounded in a shooting."
6/13/20,Atlanta,Georgia,2,5,7,"An individual shot at a large group of people from a vehicle, killing two people and wounding five."
6/13/20,Washington D.C.,Washington D.C.,2,5,7,Shortly before midnight responding officers discovered seven shooting victims. A man and woman later died at local hospitals with five other men wounded.
6/12/20,Venus,Texas,0,6,6,"Six people were wounded at a rodeo outdoor live music venue, with one to two thousand attendees present. Police had been called to the venue three times prior to the shooting, due to fights."
6/11/20,New Orleans,Louisiana,2,2,4,Two people were wounded and two killed in the Hollygrove section of the city. One of those killed may have been the target of the shooting.
6/9/20,Commerce City,Colorado,0,4,4,Four people were wounded at a large house party after a fight broke out in the early morning.
6/9/20,Sparta,Georgia,1,6,7,Responding officers found a man dead and two wounded at an early morning birthday party. Four other wounded were identified at the hospital.
